{
 "$schema": "https://json-schema.org/draft/2020-12/schema",
 "$id": "slate/script",
 "title": "script/script.json",
 "description": "The one hand-edited script file: acts of shots (or lines) with id, vo, on_screen, picture, sources, claims and notes. `slate script build` gates it and writes script/storyboard.json and script/SCRIPT.md. Unknown keys are allowed and carried through.",
 "type": "object",
 "required": ["acts"],
 "properties": {
  "title": {"type": "string"},
  "version": {"type": "string", "description": "the change note for this draft"},
  "language": {"type": "string"},
  "ids": {"enum": ["as-written", "renumber"], "description": "renumber: the written ids are draft ids; shots are numbered <id_prefix>01… in order and mentions are remapped"},
  "id_prefix": {"type": "string", "pattern": "^[A-Za-z]+$"},
  "defaults": {"type": "object", "properties": {"enter_token": {"type": "string"}}},
  "timing": {
   "type": "object",
   "description": "Overrides for placement and pace (seconds, words a second).",
   "properties": {
    "lead": {"type": "number", "minimum": 0},
    "tail": {"type": "number", "minimum": 0},
    "act_tail": {"type": "number", "minimum": 0},
    "min_tail": {"type": "number", "minimum": 0},
    "speech_rate": {"type": "number", "exclusiveMinimum": 0},
    "max_pace": {"type": "number", "exclusiveMinimum": 0},
    "pace_headroom": {"type": "number", "minimum": 1},
    "two_word_share": {"type": "number", "exclusiveMinimum": 0, "exclusiveMaximum": 1}
   },
   "additionalProperties": false
  },
  "rules": {
   "type": "object",
   "description": "This film's own script rules, on top of the gates every film gets.",
   "properties": {
    "vo_dashes": {"enum": ["allow", "review", "fail"]},
    "first_line": {"type": "string"},
    "every_shot_sourced": {"type": "boolean"},
    "on_screen_max_words": {"type": "number", "minimum": 1},
    "read_time": {"type": "object"}
   }
  },
  "derived_from": {"type": "object", "description": "a derived film's parent script (slate variant writes it): {film, path, sha256}"},
  "cut": {"type": "object", "description": "a cut-down: {target_s, keep: [the parent's shot ids to keep]}; with no acts of its own the script is those shots",
          "properties": {"keep": {"type": "array", "items": {"type": "string"}}}},
  "translate": {"type": "object", "description": "a translation: {from, to}; every shot keeps its parent's id"},
  "acts": {"type": "array", "items": {"$ref": "#/$defs/act"},
           "description": "Empty in a new film until someone writes the first act (`slate new` scaffolds it that way); `slate script build` refuses to build a script with no acts."}
 },
 "$defs": {
  "act": {
   "type": "object",
   "required": ["name"],
   "properties": {
    "name": {"type": "string", "minLength": 1},
    "job": {"type": "string"},
    "intent": {"type": "string"},
    "shots": {"type": "array", "minItems": 1, "items": {"$ref": "#/$defs/shot"}},
    "lines": {"type": "array", "minItems": 1, "items": {"$ref": "#/$defs/shot"}}
   },
   "anyOf": [{"required": ["shots"]}, {"required": ["lines"]}]
  },
  "shot": {
   "type": "object",
   "required": ["id"],
   "properties": {
    "id": {"type": "string", "pattern": "^[A-Za-z][A-Za-z0-9_.-]*$"},
    "vo": {"type": "string"},
    "on_screen": {"oneOf": [{"type": "string"}, {"type": "array", "items": {"type": "string"}}]},
    "picture": {"type": "string"},
    "transition": {"description": "How the shot hands to the next, in the motion law's kinds: carry, portal, mask, whip (motion-masked), ui_cut (a UI state cut with the camera locked), music_cut (a cut on a musical hit) or seam (a blend of 4 frames or less inside one generated shot). Words that name one, as the films wrote them (\"Carry: the line keeps drawing\", sorted into the kinds by slate.qa.checks.picture.transition_kind), or {kind, note}. Carried through storyboard.json into timing/shots.json (transition_out); `slate qa cuts` judges every scene change against it.",
                   "oneOf": [{"type": "string"},
                             {"type": "object", "required": ["kind"], "additionalProperties": false,
                              "properties": {"kind": {"$ref": "#/$defs/transition_kind"}, "note": {"type": "string"}}}]},
    "engine": {"enum": ["remotion", "web", "ae"], "description": "the engine that draws this shot when it isn't its act's (P074; docs/ARCHITECTURE.md §8): carried through storyboard.json into timing/shots.json, where `slate render` and `slate check` read it"},
    "build": {"type": "string"},
    "sound": {"type": "string"},
    "notes": {"type": "string"},
    "source": {"type": "string"},
    "sources": {"oneOf": [{"type": "string"}, {"type": "array", "items": {"$ref": "#/$defs/source_ref"}}]},
    "claims": {"type": "array", "items": {"$ref": "#/$defs/claim"}},
    "quotes": {"type": "array", "items": {"$ref": "#/$defs/quote"}},
    "enter_token": {"type": "string"},
    "lead": {"type": "number", "minimum": 0},
    "hold": {"type": "number", "minimum": 0},
    "dur": {"type": "number", "exclusiveMinimum": 0},
    "act_end": {"type": "boolean"},
    "events": {"type": "array", "items": {"$ref": "#/$defs/event"}},
    "generate": {"type": "object", "description": "a generation request for this shot (`slate gen` reads it); carried through storyboard.json into timing/shots.json"},
    "reading": {"type": "object", "description": "how the shot's text is read, with its reason: {\"voice_matched\": true | [statements], \"not_for_reading\": true | [statements], \"labels\": true, \"reason\": \"…\"}. A voice-matched definition may pass the word budget and needs only the 1.5 s floor; a surface not for reading isn't timed; labels (the words name what the picture shows: a product's UI, a Simulator label, an end card) may pass 40% of the voice but still count toward the cap and are timed in full. Carried into storyboard.json; the script gates and `slate qa readtime` honour it, with one meaning.",
                "properties": {"voice_matched": {"anyOf": [{"type": "boolean"}, {"type": "array", "items": {"type": "string"}}]},
                               "not_for_reading": {"anyOf": [{"type": "boolean"}, {"type": "array", "items": {"type": "string"}}]},
                               "labels": {"type": "boolean"},
                               "reason": {"type": "string"},
                               "count_events": {"$ref": "#/$defs/count_events"}}}
   }
  },
  "count_events": {
   "type": "array", "minItems": 1,
   "description": "Exact literal on_screen display parts and their distinct canonical visual event ids. Metadata needs no exemption reason. The counted final display holds for at least 2 s after its latest declared landing and complete legible onset; the ids remain exact through shot renumbering.",
   "items": {"type": "object", "required": ["text", "events"], "additionalProperties": false,
             "properties": {"text": {"type": "string", "minLength": 1, "pattern": "\\S"},
                            "events": {"type": "array", "minItems": 1, "uniqueItems": true,
                                       "items": {"type": "string", "minLength": 1, "pattern": "\\S"}}}}
  },
  "source_ref": {
   "oneOf": [
    {"type": "string", "minLength": 1, "description": "<source id> or <source id>:<where>, or a note"},
    {"type": "object", "required": ["ref"],
     "properties": {"ref": {"type": "string", "description": "<source id> or <source id>:<where>"}, "numbers": {"type": "array"},
                    "quote": {"type": "string", "description": "the source's exact words this shot shows (product copy); the script's quote gate finds them at `where`"},
                    "where": {"type": "string", "description": "where the quote is, as path:line or path:first-last (else the part of ref after its colon)"}}}
   ]
  },
  "claim": {
   "oneOf": [
    {"type": "string", "minLength": 1, "description": "an approved claim's id or text, or a claim id in brief/truth.json"},
    {"type": "object",
     "properties": {"text": {"type": "string"}, "approved": {"type": "string"}, "source": {"type": "string"},
                    "numbers": {"type": "array"}},
     "anyOf": [{"required": ["text"]}, {"required": ["approved"]}]}
   ]
  },
  "transition_kind": {"enum": ["carry", "portal", "mask", "whip", "ui_cut", "music_cut", "seam"],
                      "description": "the motion law's transitions (slate.qa.checks.picture.TRANSITIONS)"},
  "quote": {
   "type": "object",
   "required": ["text"],
   "properties": {"text": {"type": "string"}, "by": {"type": "string"}, "role": {"type": "string"},
                  "source": {"type": "string"}, "real": {"type": "boolean"}}
  },
  "event": {
   "type": "object",
   "required": ["id"],
   "properties": {
    "id": {"type": "string"},
    "t": {"type": "number"},
    "word": {"type": "string"},
    "occ": {"type": "integer", "minimum": 1},
    "offset": {"type": "number"},
    "land": {"type": "string", "pattern": "^[^:]+:[0-9]*\\.?[0-9]+$"},
    "note": {"type": "string"}
   },
   "anyOf": [{"required": ["t"]}, {"required": ["word"]}]
  }
 }
}
